code|name|category|featured
SI.DST.02ND.20|Income share held by second 20%|Poverty|TRUE
SI.DST.03RD.20|Income share held by third 20%|Poverty|TRUE
EN.POP.SLUM.UR.ZS|Population living in slums (% of urban population)|Poverty|TRUE
SI.POV.GAPS|Poverty gap at $2.15 a day (2017 PPP) (%)|Poverty|TRUE
SI.POV.LMIC.GP|Poverty gap at $3.65 a day (2017 PPP) (%)|Poverty|FALSE
SI.POV.UMIC.GP|Poverty gap at $6.85 a day (2017 PPP) (%)|Poverty|FALSE
SI.POV.DDAY|Poverty headcount ratio at $2.15 a day (2017 PPP) (% of population)|Poverty|TRUE
SI.POV.LMIC|Poverty headcount ratio at $3.65 a day (2017 PPP) (% of population)|Poverty|FALSE
SI.POV.UMIC|Poverty headcount ratio at $6.85 a day (2017 PPP) (% of population)|Poverty|FALSE
SI.POV.NAHC|Poverty headcount ratio at national poverty lines (% of population)|Poverty|TRUE
SI.DST.50MD|Proportion of people living below 50 percent of median income (%)|Poverty|FALSE
SI.SPR.PC40|Survey mean consumption or income per capita, bottom 40% of population (2017 PPP $ per day)|Poverty|TRUE
SI.SPR.PCAP|Survey mean consumption or income per capita, total population (2017 PPP $ per day)|Poverty|TRUE
TX.VAL.AGRI.ZS.UN|Agricultural raw materials exports (% of merchandise exports)|Private Sector|FALSE
TM.VAL.AGRI.ZS.UN|Agricultural raw materials imports (% of merchandise imports)|Private Sector|FALSE
IC.CUS.DURS.EX|Average time to clear exports through customs (days)|Private Sector|FALSE
TM.TAX.MRCH.BC.ZS|Binding coverage, all products (%)|Private Sector|FALSE
TM.TAX.MANF.BC.ZS|Binding coverage, manufactured products (%)|Private Sector|FALSE
TM.TAX.TCOM.BC.ZS|Binding coverage, primary products (%)|Private Sector|FALSE
TM.TAX.MRCH.BR.ZS|Bound rate, simple mean, all products (%)|Private Sector|FALSE
TM.TAX.MANF.BR.ZS|Bound rate, simple mean, manufactured products (%)|Private Sector|FALSE
TM.TAX.TCOM.BR.ZS|Bound rate, simple mean, primary products (%)|Private Sector|FALSE
IC.FRM.BRIB.ZS|Bribery incidence (% of firms experiencing at least one bribe payment request)|Private Sector|FALSE
IC.BUS.DISC.XQ|Business extent of disclosure index (0=less disclosure to 10=more disclosure)|Private Sector|TRUE
TX.VAL.SERV.CD.WT|Commercial service exports (current US$)|Private Sector|FALSE
TM.VAL.SERV.CD.WT|Commercial service imports (current US$)|Private Sector|FALSE
TX.VAL.OTHR.ZS.WT|Computer, communications and other services (% of commercial service exports)|Private Sector|FALSE
TM.VAL.OTHR.ZS.WT|Computer, communications and other services (% of commercial service imports)|Private Sector|FALSE
IC.REG.COST.PC.ZS|Cost of business start-up procedures (% of GNI per capita)|Private Sector|FALSE
IC.REG.COST.PC.FE.ZS|Cost of business start-up procedures, female (% of GNI per capita)|Private Sector|FALSE
IC.REG.COST.PC.MA.ZS|Cost of business start-up procedures, male (% of GNI per capita)|Private Sector|FALSE
IC.EXP.CSBC.CD|Cost to export, border compliance (US$)|Private Sector|FALSE
IC.EXP.CSDC.CD|Cost to export, documentary compliance (US$)|Private Sector|FALSE
IC.IMP.CSBC.CD|Cost to import, border compliance (US$)|Private Sector|FALSE
IC.IMP.CSDC.CD|Cost to import, documentary compliance (US$)|Private Sector|FALSE
IC.CRD.INFO.XQ|Depth of credit information index (0=low to 8=high)|Private Sector|TRUE
FS.AST.PRVT.GD.ZS|Domestic credit to private sector (% of GDP)|Private Sector|TRUE
IC.BUS.EASE.XQ|Ease of doing business rank (1=most business-friendly regulations)|Private Sector|TRUE
IC.BUS.DFRN.XQ|Ease of doing business score (0 = lowest performance to 100 = best performance)|Private Sector|FALSE
TX.UVI.MRCH.XD.WD|Export unit value index (2015 = 100)|Private Sector|FALSE
TX.VAL.MRCH.XD.WD|Export value index (2015 = 100)|Private Sector|FALSE
TX.QTY.MRCH.XD.WD|Export volume index (2015 = 100)|Private Sector|FALSE
IC.FRM.CMPU.ZS|Firms competing against unregistered firms (% of firms)|Private Sector|FALSE
IC.TAX.GIFT.ZS|Firms expected to give gifts in meetings with tax officials (% of firms)|Private Sector|FALSE
IC.ELC.OUTG.ZS|Firms experiencing electrical outages (% of firms)|Private Sector|TRUE
IC.FRM.THEV.ZS|Firms experiencing losses due to theft and vandalism (% of firms)|Private Sector|TRUE
IC.FRM.FREG.ZS|Firms formally registered when operations started (% of firms)|Private Sector|FALSE
IC.FRM.TRNG.ZS|Firms offering formal training (% of firms)|Private Sector|FALSE
IC.FRM.INFM.ZS|Firms that do not report all sales for tax purposes (% of firms)|Private Sector|FALSE
IC.FRM.RSDV.ZS|Firms that spend on R&D (% of firms)|Private Sector|TRUE
IC.FRM.BNKS.ZS|Firms using banks to finance investment (% of firms)|Private Sector|FALSE
IC.FRM.BKWC.ZS|Firms using banks to finance working capital (% of firms)|Private Sector|TRUE
IC.FRM.METG.ZS|Firms visited or required meetings with tax officials (% of firms)|Private Sector|TRUE
IC.FRM.FEMO.ZS|Firms with female participation in ownership (% of firms)|Private Sector|TRUE
IC.FRM.FEMM.ZS|Firms with female top manager (% of firms)|Private Sector|TRUE
TX.VAL.FOOD.ZS.UN|Food exports (% of merchandise exports)|Private Sector|FALSE
TM.VAL.FOOD.ZS.UN|Food imports (% of merchandise imports)|Private Sector|FALSE
TX.VAL.FUEL.ZS.UN|Fuel exports (% of merchandise exports)|Private Sector|TRUE
TM.VAL.FUEL.ZS.UN|Fuel imports (% of merchandise imports)|Private Sector|FALSE
TX.VAL.TECH.MF.ZS|High-technology exports (% of manufactured exports)|Private Sector|TRUE
TX.VAL.TECH.CD|High-technology exports (current US$)|Private Sector|TRUE
TX.VAL.ICTG.ZS.UN|ICT goods exports (% of total goods exports)|Private Sector|FALSE
TM.VAL.ICTG.ZS.UN|ICT goods imports (% total goods imports)|Private Sector|FALSE
TM.UVI.MRCH.XD.WD|Import unit value index (2015 = 100)|Private Sector|FALSE
TM.VAL.MRCH.XD.WD|Import value index (2015 = 100)|Private Sector|FALSE
TM.QTY.MRCH.XD.WD|Import volume index (2015 = 100)|Private Sector|FALSE
IC.FRM.CORR.ZS|Informal payments to public officials (% of firms)|Private Sector|FALSE
TX.VAL.INSF.ZS.WT|Insurance and financial services (% of commercial service exports)|Private Sector|FALSE
TM.VAL.INSF.ZS.WT|Insurance and financial services (% of commercial service imports)|Private Sector|FALSE
BX.GSR.INSF.ZS|Insurance and financial services (% of service exports, BoP)|Private Sector|FALSE
BM.GSR.INSF.ZS|Insurance and financial services (% of service imports, BoP)|Private Sector|FALSE
ST.INT.XPND.MP.ZS|International tourism, expenditures (% of total imports)|Private Sector|TRUE
ST.INT.XPND.CD|International tourism, expenditures (current US$)|Private Sector|FALSE
ST.INT.TRNX.CD|International tourism, expenditures for passenger transport items (current US$)|Private Sector|FALSE
ST.INT.TVLX.CD|International tourism, expenditures for travel items (current US$)|Private Sector|FALSE
ST.INT.ARVL|International tourism, number of arrivals|Private Sector|FALSE
ST.INT.DPRT|International tourism, number of departures|Private Sector|FALSE
ST.INT.RCPT.XP.ZS|International tourism, receipts (% of total exports)|Private Sector|TRUE
ST.INT.RCPT.CD|International tourism, receipts (current US$)|Private Sector|FALSE
ST.INT.TRNR.CD|International tourism, receipts for passenger transport items (current US$)|Private Sector|FALSE
ST.INT.TVLR.CD|International tourism, receipts for travel items (current US$)|Private Sector|FALSE
IE.PPI.ENGY.CD|Investment in energy with private participation (current US$)|Private Sector|TRUE
IE.PPI.TRAN.CD|Investment in transport with private participation (current US$)|Private Sector|TRUE
IE.PPI.WATR.CD|Investment in water and sanitation with private participation (current US$)|Private Sector|TRUE
IC.TAX.LABR.CP.ZS|Labor tax and contributions (% of commercial profits)|Private Sector|FALSE
LP.EXP.DURS.MD|Lead time to export, median case (days)|Private Sector|TRUE
LP.IMP.DURS.MD|Lead time to import, median case (days)|Private Sector|TRUE
LP.LPI.TRAC.XQ|Logistics performance index: Ability to track and trace consignments (1=low to 5=high)|Private Sector|FALSE
LP.LPI.LOGS.XQ|Logistics performance index: Competence and quality of logistics services (1=low to 5=high)|Private Sector|FALSE
LP.LPI.ITRN.XQ|Logistics performance index: Ease of arranging competitively priced shipments (1=low to 5=high)|Private Sector|FALSE
LP.LPI.CUST.XQ|Logistics performance index: Efficiency of customs clearance process (1=low to 5=high)|Private Sector|FALSE
LP.LPI.TIME.XQ|Logistics performance index: Frequency with which shipments reach consignee within scheduled or expected time (1=low to 5=high)|Private Sector|FALSE
LP.LPI.OVRL.XQ|Logistics performance index: Overall (1=low to 5=high)|Private Sector|TRUE
LP.LPI.INFR.XQ|Logistics performance index: Quality of trade and transport-related infrastructure (1=low to 5=high)|Private Sector|FALSE
IC.FRM.CRIM.ZS|Losses due to theft and vandalism (% of annual sales for affected firms)|Private Sector|FALSE
TX.VAL.MANF.ZS.UN|Manufactures exports (% of merchandise exports)|Private Sector|FALSE
TM.VAL.MANF.ZS.UN|Manufactures imports (% of merchandise imports)|Private Sector|FALSE
TX.MNF.TECH.ZS.UN|Medium and high-tech exports (% manufactured exports)|Private Sector|TRUE
TX.VAL.MRCH.CD.WT|Merchandise exports (current US$)|Private Sector|TRUE
TX.VAL.MRCH.WL.CD|Merchandise exports by the reporting economy (current US$)|Private Sector|FALSE
TX.VAL.MRCH.RS.ZS|Merchandise exports by the reporting economy, residual (% of total merchandise exports)|Private Sector|FALSE
TX.VAL.MRCH.AL.ZS|Merchandise exports to economies in the Arab World (% of total merchandise exports)|Private Sector|FALSE
TX.VAL.MRCH.HI.ZS|Merchandise exports to high-income economies (% of total merchandise exports)|Private Sector|FALSE
TX.VAL.MRCH.R1.ZS|Merchandise exports to low- and middle-income economies in East Asia & Pacific (% of total merchandise exports)|Private Sector|FALSE
TX.VAL.MRCH.R2.ZS|Merchandise exports to low- and middle-income economies in Europe & Central Asia (% of total merchandise exports)|Private Sector|FALSE
TX.VAL.MRCH.R3.ZS|Merchandise exports to low- and middle-income economies in Latin America & the Caribbean (% of total merchandise exports)|Private Sector|FALSE
TX.VAL.MRCH.R4.ZS|Merchandise exports to low- and middle-income economies in Middle East & North Africa (% of total merchandise exports)|Private Sector|FALSE
TX.VAL.MRCH.R5.ZS|Merchandise exports to low- and middle-income economies in South Asia (% of total merchandise exports)|Private Sector|FALSE
TX.VAL.MRCH.R6.ZS|Merchandise exports to low- and middle-income economies in Sub-Saharan Africa (% of total merchandise exports)|Private Sector|FALSE
TX.VAL.MRCH.OR.ZS|Merchandise exports to low- and middle-income economies outside region (% of total merchandise exports)|Private Sector|FALSE
TX.VAL.MRCH.WR.ZS|Merchandise exports to low- and middle-income economies within region (% of total merchandise exports)|Private Sector|FALSE
TM.VAL.MRCH.CD.WT|Merchandise imports (current US$)|Private Sector|TRUE
TM.VAL.MRCH.WL.CD|Merchandise imports by the reporting economy (current US$)|Private Sector|FALSE
TM.VAL.MRCH.RS.ZS|Merchandise imports by the reporting economy, residual (% of total merchandise imports)|Private Sector|FALSE
TM.VAL.MRCH.AL.ZS|Merchandise imports from economies in the Arab World (% of total merchandise imports)|Private Sector|FALSE
TM.VAL.MRCH.HI.ZS|Merchandise imports from high-income economies (% of total merchandise imports)|Private Sector|FALSE
TM.VAL.MRCH.R1.ZS|Merchandise imports from low- and middle-income economies in East Asia & Pacific (% of total merchandise imports)|Private Sector|FALSE
TM.VAL.MRCH.R2.ZS|Merchandise imports from low- and middle-income economies in Europe & Central Asia (% of total merchandise imports)|Private Sector|FALSE
TM.VAL.MRCH.R3.ZS|Merchandise imports from low- and middle-income economies in Latin America & the Caribbean (% of total merchandise imports)|Private Sector|FALSE
TM.VAL.MRCH.R4.ZS|Merchandise imports from low- and middle-income economies in Middle East & North Africa (% of total merchandise imports)|Private Sector|FALSE
TM.VAL.MRCH.R5.ZS|Merchandise imports from low- and middle-income economies in South Asia (% of total merchandise imports)|Private Sector|FALSE
TM.VAL.MRCH.R6.ZS|Merchandise imports from low- and middle-income economies in Sub-Saharan Africa (% of total merchandise imports)|Private Sector|FALSE
TM.VAL.MRCH.OR.ZS|Merchandise imports from low- and middle-income economies outside region (% of total merchandise imports)|Private Sector|FALSE
TM.VAL.MRCH.WR.ZS|Merchandise imports from low- and middle-income economies within region (% of total merchandise imports)|Private Sector|FALSE
TG.VAL.TOTL.GD.ZS|Merchandise trade (% of GDP)|Private Sector|TRUE
TT.PRI.MRCH.XD.WD|Net barter terms of trade index (2015 = 100)|Private Sector|TRUE
IC.BUS.NDNS.ZS|New business density (new registrations per 1,000 people ages 15-64)|Private Sector|FALSE
IC.BUS.NREG|New businesses registered (number)|Private Sector|TRUE
IC.TAX.METG|Number of visits or required meetings with tax officials (average for affected firms)|Private Sector|FALSE
TX.VAL.MMTL.ZS.UN|Ores and metals exports (% of merchandise exports)|Private Sector|TRUE
TM.VAL.MMTL.ZS.UN|Ores and metals imports (% of merchandise imports)|Private Sector|FALSE
IC.TAX.OTHR.CP.ZS|Other taxes payable by businesses (% of commercial profits)|Private Sector|FALSE
IC.ELC.OUTG|Power outages in firms in a typical month (number)|Private Sector|FALSE
IC.CRD.PRVT.ZS|Private credit bureau coverage (% of adults)|Private Sector|FALSE
IC.WRH.PROC|Procedures to build a warehouse (number)|Private Sector|FALSE
IC.PRP.PROC|Procedures to register property (number)|Private Sector|FALSE
IC.TAX.PRFT.CP.ZS|Profit tax (% of commercial profits)|Private Sector|FALSE
IC.CRD.PUBL.ZS|Public credit registry coverage (% of adults)|Private Sector|FALSE
TM.TAX.MRCH.IP.ZS|Share of tariff lines with international peaks, all products (%)|Private Sector|FALSE
TM.TAX.MANF.IP.ZS|Share of tariff lines with international peaks, manufactured products (%)|Private Sector|FALSE
TM.TAX.TCOM.IP.ZS|Share of tariff lines with international peaks, primary products (%)|Private Sector|FALSE
TM.TAX.MRCH.SR.ZS|Share of tariff lines with specific rates, all products (%)|Private Sector|FALSE
TM.TAX.MANF.SR.ZS|Share of tariff lines with specific rates, manufactured products (%)|Private Sector|FALSE
TM.TAX.TCOM.SR.ZS|Share of tariff lines with specific rates, primary products (%)|Private Sector|FALSE
IC.REG.PROC|Start-up procedures to register a business (number)|Private Sector|TRUE
IC.REG.PROC.FE|Start-up procedures to register a business, female (number)|Private Sector|TRUE
IC.REG.PROC.MA|Start-up procedures to register a business, male (number)|Private Sector|TRUE
IC.LGL.CRED.XQ|Strength of legal rights index (0=weak to 12=strong)|Private Sector|TRUE
TM.TAX.MRCH.SM.AR.ZS|Tariff rate, applied, simple mean, all products (%)|Private Sector|FALSE
TM.TAX.MANF.SM.AR.ZS|Tariff rate, applied, simple mean, manufactured products (%)|Private Sector|FALSE
TM.TAX.TCOM.SM.AR.ZS|Tariff rate, applied, simple mean, primary products (%)|Private Sector|FALSE
TM.TAX.MRCH.WM.AR.ZS|Tariff rate, applied, weighted mean, all products (%)|Private Sector|FALSE
TM.TAX.MANF.WM.AR.ZS|Tariff rate, applied, weighted mean, manufactured products (%)|Private Sector|FALSE
TM.TAX.TCOM.WM.AR.ZS|Tariff rate, applied, weighted mean, primary products (%)|Private Sector|FALSE
TM.TAX.MRCH.SM.FN.ZS|Tariff rate, most favored nation, simple mean, all products (%)|Private Sector|FALSE
TM.TAX.MANF.SM.FN.ZS|Tariff rate, most favored nation, simple mean, manufactured products (%)|Private Sector|FALSE
TM.TAX.TCOM.SM.FN.ZS|Tariff rate, most favored nation, simple mean, primary products (%)|Private Sector|FALSE
TM.TAX.MRCH.WM.FN.ZS|Tariff rate, most favored nation, weighted mean, all products (%)|Private Sector|FALSE
TM.TAX.MANF.WM.FN.ZS|Tariff rate, most favored nation, weighted mean, manufactured products (%)|Private Sector|FALSE
TM.TAX.TCOM.WM.FN.ZS|Tariff rate, most favored nation, weighted mean, primary products (%)|Private Sector|FALSE
IC.TAX.PAYM|Tax payments (number)|Private Sector|FALSE
IC.WRH.DURS|Time required to build a warehouse (days)|Private Sector|FALSE
IC.LGL.DURS|Time required to enforce a contract (days)|Private Sector|FALSE
IC.ELC.TIME|Time required to get electricity (days)|Private Sector|TRUE
IC.FRM.DURS|Time required to obtain an operating license (days)|Private Sector|FALSE
IC.PRP.DURS|Time required to register property (days)|Private Sector|FALSE
IC.REG.DURS|Time required to start a business (days)|Private Sector|TRUE
IC.REG.DURS.FE|Time required to start a business, female (days)|Private Sector|TRUE
IC.REG.DURS.MA|Time required to start a business, male (days)|Private Sector|TRUE
IC.GOV.DURS.ZS|Time spent dealing with the requirements of government regulations (% of senior management time)|Private Sector|TRUE
IC.EXP.TMBC|Time to export, border compliance (hours)|Private Sector|FALSE
IC.EXP.TMDC|Time to export, documentary compliance (hours)|Private Sector|FALSE
IC.IMP.TMBC|Time to import, border compliance (hours)|Private Sector|FALSE
IC.IMP.TMDC|Time to import, documentary compliance (hours)|Private Sector|FALSE
IC.ELC.DURS|Time to obtain an electrical connection (days)|Private Sector|FALSE
IC.TAX.DURS|Time to prepare and pay taxes (hours)|Private Sector|FALSE
IC.ISV.DURS|Time to resolve insolvency (years)|Private Sector|FALSE
IC.TAX.TOTL.CP.ZS|Total tax and contribution rate (% of profit)|Private Sector|TRUE
BG.GSR.NFSV.GD.ZS|Trade in services (% of GDP)|Private Sector|FALSE
TX.VAL.TRAN.ZS.WT|Transport services (% of commercial service exports)|Private Sector|FALSE
TM.VAL.TRAN.ZS.WT|Transport services (% of commercial service imports)|Private Sector|FALSE
TX.VAL.TRVL.ZS.WT|Travel services (% of commercial service exports)|Private Sector|FALSE
TM.VAL.TRVL.ZS.WT|Travel services (% of commercial service imports)|Private Sector|FALSE
IC.FRM.OUTG.ZS|Value lost due to electrical outages (% of sales for affected firms)|Private Sector|FALSE
MS.MIL.TOTL.TF.ZS|Armed forces personnel (% of total labor force)|Public Sector|FALSE
MS.MIL.TOTL.P1|Armed forces personnel, total|Public Sector|FALSE
MS.MIL.XPRT.KD|Arms exports (SIPRI trend indicator values)|Public Sector|FALSE
MS.MIL.MPRT.KD|Arms imports (SIPRI trend indicator values)|Public Sector|FALSE
VC.BTL.DETH|Battle-related deaths (number of people)|Public Sector|FALSE
IQ.CPA.HRES.XQ|CPIA building human resources rating (1=low to 6=high)|Public Sector|FALSE
IQ.CPA.BREG.XQ|CPIA business regulatory environment rating (1=low to 6=high)|Public Sector|FALSE
IQ.CPA.DEBT.XQ|CPIA debt policy rating (1=low to 6=high)|Public Sector|FALSE
IQ.CPA.ECON.XQ|CPIA economic management cluster average (1=low to 6=high)|Public Sector|TRUE
IQ.CPA.REVN.XQ|CPIA efficiency of revenue mobilization rating (1=low to 6=high)|Public Sector|FALSE
IQ.CPA.PRES.XQ|CPIA equity of public resource use rating (1=low to 6=high)|Public Sector|FALSE
IQ.CPA.FINS.XQ|CPIA financial sector rating (1=low to 6=high)|Public Sector|FALSE
IQ.CPA.FISP.XQ|CPIA fiscal policy rating (1=low to 6=high)|Public Sector|FALSE
IQ.CPA.GNDR.XQ|CPIA gender equality rating (1=low to 6=high)|Public Sector|FALSE
IQ.CPA.MACR.XQ|CPIA macroeconomic management rating (1=low to 6=high)|Public Sector|FALSE
IQ.CPA.SOCI.XQ|CPIA policies for social inclusion/equity cluster average (1=low to 6=high)|Public Sector|TRUE
IQ.CPA.ENVR.XQ|CPIA policy and institutions for environmental sustainability rating (1=low to 6=high)|Public Sector|FALSE
IQ.CPA.PROP.XQ|CPIA property rights and rule-based governance rating (1=low to 6=high)|Public Sector|FALSE
IQ.CPA.PUBS.XQ|CPIA public sector management and institutions cluster average (1=low to 6=high)|Public Sector|TRUE
IQ.CPA.FINQ.XQ|CPIA quality of budgetary and financial management rating (1=low to 6=high)|Public Sector|FALSE
IQ.CPA.PADM.XQ|CPIA quality of public administration rating (1=low to 6=high)|Public Sector|FALSE
IQ.CPA.PROT.XQ|CPIA social protection rating (1=low to 6=high)|Public Sector|FALSE
IQ.CPA.STRC.XQ|CPIA structural policies cluster average (1=low to 6=high)|Public Sector|TRUE
IQ.CPA.TRAD.XQ|CPIA trade rating (1=low to 6=high)|Public Sector|FALSE
IQ.CPA.TRAN.XQ|CPIA transparency, accountability, and corruption in the public sector rating (1=low to 6=high)|Public Sector|FALSE
GC.DOD.TOTL.GD.ZS|Central government debt, total (% of GDP)|Public Sector|TRUE
GC.DOD.TOTL.CN|Central government debt, total (current LCU)|Public Sector|FALSE
GC.XPN.COMP.ZS|Compensation of employees (% of expense)|Public Sector|FALSE
GC.XPN.COMP.CN|Compensation of employees (current LCU)|Public Sector|FALSE
CC.EST|Control of Corruption: Estimate|Public Sector|FALSE
CC.NO.SRC|Control of Corruption: Number of Sources|Public Sector|FALSE
CC.PER.RNK|Control of Corruption: Percentile Rank|Public Sector|FALSE
CC.PER.RNK.LOWER|Control of Corruption: Percentile Rank, Lower Bound of 90% Confidence Interval|Public Sector|FALSE
CC.PER.RNK.UPPER|Control of Corruption: Percentile Rank, Upper Bound of 90% Confidence Interval|Public Sector|FALSE
CC.STD.ERR|Control of Corruption: Standard Error|Public Sector|FALSE
GC.TAX.IMPT.ZS|Customs and other import duties (% of tax revenue)|Public Sector|FALSE
GC.TAX.IMPT.CN|Customs and other import duties (current LCU)|Public Sector|FALSE
GC.XPN.TOTL.GD.ZS|Expense (% of GDP)|Public Sector|TRUE
GC.XPN.TOTL.CN|Expense (current LCU)|Public Sector|FALSE
GC.XPN.GSRV.ZS|Goods and services expense (% of expense)|Public Sector|FALSE
GC.XPN.GSRV.CN|Goods and services expense (current LCU)|Public Sector|FALSE
GE.EST|Government Effectiveness: Estimate|Public Sector|FALSE
GE.NO.SRC|Government Effectiveness: Number of Sources|Public Sector|FALSE
GE.PER.RNK|Government Effectiveness: Percentile Rank|Public Sector|FALSE
GE.PER.RNK.LOWER|Government Effectiveness: Percentile Rank, Lower Bound of 90% Confidence Interval|Public Sector|FALSE
GE.PER.RNK.UPPER|Government Effectiveness: Percentile Rank, Upper Bound of 90% Confidence Interval|Public Sector|FALSE
GE.STD.ERR|Government Effectiveness: Standard Error|Public Sector|FALSE
GC.REV.GOTR.ZS|Grants and other revenue (% of revenue)|Public Sector|FALSE
GC.REV.GOTR.CN|Grants and other revenue (current LCU)|Public Sector|FALSE
HD.HCI.OVRL|Human Capital Index (HCI) (scale 0-1)|Public Sector|FALSE
HD.HCI.OVRL.FE|Human Capital Index (HCI), Female (scale 0-1)|Public Sector|FALSE
HD.HCI.OVRL.LB.FE|Human Capital Index (HCI), Female, Lower Bound (scale 0-1)|Public Sector|FALSE
HD.HCI.OVRL.UB.FE|Human Capital Index (HCI), Female, Upper Bound (scale 0-1)|Public Sector|FALSE
HD.HCI.OVRL.LB|Human Capital Index (HCI), Lower Bound (scale 0-1)|Public Sector|FALSE
HD.HCI.OVRL.MA|Human Capital Index (HCI), Male (scale 0-1)|Public Sector|FALSE
HD.HCI.OVRL.LB.MA|Human Capital Index (HCI), Male, Lower Bound (scale 0-1)|Public Sector|FALSE
HD.HCI.OVRL.UB.MA|Human Capital Index (HCI), Male, Upper Bound (scale 0-1)|Public Sector|FALSE
HD.HCI.OVRL.UB|Human Capital Index (HCI), Upper Bound (scale 0-1)|Public Sector|FALSE
IQ.CPA.IRAI.XQ|IDA resource allocation index (1=low to 6=high)|Public Sector|TRUE
VC.IHR.PSRC.P5|Intentional homicides (per 100,000 people)|Public Sector|TRUE
VC.IHR.PSRC.FE.P5|Intentional homicides, female (per 100,000 female)|Public Sector|FALSE
VC.IHR.PSRC.MA.P5|Intentional homicides, male (per 100,000 male)|Public Sector|FALSE
GC.XPN.INTP.ZS|Interest payments (% of expense)|Public Sector|FALSE
GC.XPN.INTP.RV.ZS|Interest payments (% of revenue)|Public Sector|FALSE
GC.XPN.INTP.CN|Interest payments (current LCU)|Public Sector|FALSE
VC.IDP.NWCV|Internally displaced persons, new displacement associated with conflict and violence (number of cases)|Public Sector|FALSE
VC.IDP.NWDS|Internally displaced persons, new displacement associated with disasters (number of cases)|Public Sector|FALSE
VC.IDP.TOCV|Internally displaced persons, total displaced by conflict and violence (number of people)|Public Sector|FALSE
MS.MIL.XPND.GD.ZS|Military expenditure (% of GDP)|Public Sector|TRUE
MS.MIL.XPND.ZS|Military expenditure (% of general government expenditure)|Public Sector|TRUE
MS.MIL.XPND.CN|Military expenditure (current LCU)|Public Sector|FALSE
MS.MIL.XPND.CD|Military expenditure (current USD)|Public Sector|FALSE
GC.AST.TOTL.GD.ZS|Net acquisition of financial assets (% of GDP)|Public Sector|TRUE
GC.AST.TOTL.CN|Net acquisition of financial assets (current LCU)|Public Sector|FALSE
GC.LBL.TOTL.GD.ZS|Net incurrence of liabilities, total (% of GDP)|Public Sector|TRUE
GC.LBL.TOTL.CN|Net incurrence of liabilities, total (current LCU)|Public Sector|FALSE
GC.NFN.TOTL.GD.ZS|Net investment in nonfinancial assets (% of GDP)|Public Sector|TRUE
GC.NFN.TOTL.CN|Net investment in nonfinancial assets (current LCU)|Public Sector|FALSE
GC.NLD.TOTL.GD.ZS|Net lending (+) / net borrowing (-) (% of GDP)|Public Sector|TRUE
GC.NLD.TOTL.CN|Net lending (+) / net borrowing (-) (current LCU)|Public Sector|FALSE
GC.XPN.OTHR.ZS|Other expense (% of expense)|Public Sector|FALSE
GC.XPN.OTHR.CN|Other expense (current LCU)|Public Sector|FALSE
GC.TAX.OTHR.RV.ZS|Other taxes (% of revenue)|Public Sector|FALSE
GC.TAX.OTHR.CN|Other taxes (current LCU)|Public Sector|FALSE
PV.EST|Political Stability and Absence of Violence/Terrorism: Estimate|Public Sector|FALSE
PV.NO.SRC|Political Stability and Absence of Violence/Terrorism: Number of Sources|Public Sector|FALSE
PV.PER.RNK|Political Stability and Absence of Violence/Terrorism: Percentile Rank|Public Sector|FALSE
PV.PER.RNK.LOWER|Political Stability and Absence of Violence/Terrorism: Percentile Rank, Lower Bound of 90% Confidence Interval|Public Sector|FALSE
